{
  "schemaVersion": "1.0.0",
  "builderId": "local",
  "environment": "test",
  "sourceCommit": "0000000000000000000000000000000000000000",
  "lockDigest": "0000000000000000000000000000000000000000000000000000000000000000",
  "command": [
    "cargo",
    "test"
  ],
  "startedAt": "2026-01-01T00:00:00Z",
  "finishedAt": "2026-01-01T00:00:01Z",
  "materials": [
    {
      "path": "evidence/example.json",
      "sha256": "0000000000000000000000000000000000000000000000000000000000000000"
    }
  ],
  "outputs": [
    {
      "path": "evidence/example.json",
      "sha256": "0000000000000000000000000000000000000000000000000000000000000000"
    }
  ]
}
